<?xml version="1.0" encoding="UTF-8"?>
<!--
Licensed to the Apache Software Foundation (ASF) under one
or more contributor license agreements.  See the NOTICE file
distributed with this work for additional information
regarding copyright ownership.  The ASF licenses this file
to you under the Apache License, Version 2.0 (the
"License"); you may not use this file except in compliance
with the License.  You may obtain a copy of the License at

http://www.apache.org/licenses/LICENSE-2.0

Unless required by applicable law or agreed to in writing,
software distributed under the License is distributed on an
"AS IS" BASIS, WITHOUT WARRANTIES OR CONDITIONS OF ANY
KIND, either express or implied.  See the License for the
specific language governing permissions and limitations
under the License.
-->

<ofbiz-component name="webpos" enabled="true"
        xmlns:xsi="http://www.w3.org/2001/XMLSchema-instance"
        xsi:noNamespaceSchemaLocation="http://ofbiz.apache.org/dtds/ofbiz-component.xsd">
    <resource-loader name="main" type="component"/>
    <classpath type="dir" location="config"/>

    <entity-resource type="data" reader-name="seed" loader="main" location="data/WebPosSecurityPermissionSeedData.xml"/>
    <entity-resource type="data" reader-name="demo" loader="main" location="data/WebPosSecurityGroupDemoData.xml"/>

    <!-- Not sure all the POS gone data are needed here, adding them all for now, we will prune later -->
    <entity-resource type="data" reader-name="seed" loader="main" location="data/PosSecurityData.xml"/>
    <entity-resource type="data" reader-name="seed" loader="main" location="data/PosTypeData.xml"/>
    <entity-resource type="data" reader-name="demo" loader="main" location="data/DemoRetail.xml"/>
    <entity-resource type="data" reader-name="demo" loader="main" location="data/DemoPosData.xml"/>
    <entity-resource type="data" reader-name="demo" loader="main" location="data/PosSyncSettings.xml"/>

    <entity-resource type="model" reader-name="main" loader="main" location="entitydef/entitymodel.xml"/>

    <service-resource type="model" loader="main" location="servicedef/services.xml"/>
    <service-resource type="model" loader="main" location="servicedef/services_cart.xml"/>
    <service-resource type="model" loader="main" location="servicedef/services_customer.xml"/>
    <service-resource type="model" loader="main" location="servicedef/services_search.xml"/>
    <service-resource type="model" loader="main" location="servicedef/services_manager.xml"/>
    <service-resource type="model" loader="main" location="servicedef/services_payment.xml"/>
    <service-resource type="model" loader="main" location="servicedef/services_promo.xml"/>

    <webapp name="webpos"
        title="Web Pos"
        server="default-server"
        menu-name="secondary"
        location="webapp/webpos"
        base-permission="WEBPOS"
        mount-point="/webpos"
        app-bar-display="true"/>
</ofbiz-component>
