<?xml version="1.0" encoding="UTF-8"?>
<!--
Licensed to the Apache Software Foundation (ASF) under one
or more contributor license agreements.  See the NOTICE file
distributed with this work for additional information
regarding copyright ownership.  The ASF licenses this file
to you under the Apache License, Version 2.0 (the
"License"); you may not use this file except in compliance
with the License.  You may obtain a copy of the License at

http://www.apache.org/licenses/LICENSE-2.0

Unless required by applicable law or agreed to in writing,
software distributed under the License is distributed on an
"AS IS" BASIS, WITHOUT WARRANTIES OR CONDITIONS OF ANY
KIND, either express or implied.  See the License for the
specific language governing permissions and limitations
under the License.
-->

<ofbiz-component name="entity"
        xmlns:xsi="http://www.w3.org/2001/XMLSchema-instance"
        xsi:noNamespaceSchemaLocation="https://ofbiz.apache.org/dtds/ofbiz-component.xsd">
    <resource-loader name="main" type="component"/>
    <classpath type="dir" location="config"/>
    
    <entity-resource type="model" reader-name="main" loader="main" location="entitydef/entitymodel.xml"/>
    <entity-resource type="group" reader-name="main" loader="main" location="entitydef/entitygroup.xml"/>
    
    <!-- these are for unit testing -->
    <entity-resource type="model" reader-name="main" loader="main" location="entitydef/entitymodel_test.xml"/>

    <test-suite loader="main" location="testdef/entitytests.xml"/>
   
    <!-- declared first so it is stopped last, once every other container has stopped using the datasources -->
    <container name="datasource-container" loaders="main,rmi,load-data,test" class="org.apache.ofbiz.entity.DataSourceContainer"/>
    <container name="delegator-container" loaders="main" class="org.apache.ofbiz.entity.DelegatorContainer">
        <property name="preload-delegators" value="default"/>
    </container>
</ofbiz-component>
